No.,Time,Source,Destination,Protocol,Length,Info
79,0.001001,244.97.76.229,162.131.209.252,TCP,580,80  >  34913 [ACK] Seq=537 Ack=1 Win=8576 Len=536
103,0.001327,3.195.230.163,162.131.199.252,TCP,1504,80  >  37639 [ACK] Seq=1 Ack=1 Win=32120 Len=1448[Packet size limited during capture]
186,0.002423,244.45.111.217,162.131.96.123,TCP,1504,"80  >  2966 [PSH, ACK] Seq=1449 Ack=1 Win=31856 Len=1448[Packet size limited during capture]"
424,0.005812,227.247.180.181,115.48.122.194,TCP,264,"2189  >  3026 [PSH, ACK] Seq=1 Ack=1 Win=7941 Len=220[Packet size limited during capture]"
786,0.010947,244.67.6.178,0.3.117.180,TCP,44,13552  >  80 [ACK] Seq=1 Ack=1 Win=8760 Len=0
917,0.012485,3.3.131.202,2.165.134.78,TCP,1496,80  >  4242 [ACK] Seq=1 Ack=1 Win=24684 Len=1452[Packet size limited during capture]
1173,0.016324,245.227.185.206,236.40.126.25,TCP,64,2866  >  4254 [ACK] Seq=1 Ack=1 Win=8484 Len=0[Packet size limited during capture]
1239,0.017068,236.189.49.224,140.138.184.6,TCP,44,80  >  1389 [ACK] Seq=1 Ack=1 Win=8457 Len=0
1249,0.017178,236.19.147.253,3.176.114.175,TCP,44,8080  >  1750 [ACK] Seq=1 Ack=1 Win=5840 Len=0
1383,0.018716,227.247.180.175,115.46.176.179,TCP,198,"2189  >  1041 [PSH, ACK] Seq=1 Ack=1 Win=29165 Len=154[Packet size limited during capture]"
1389,0.018796,3.196.40.128,162.131.189.129,TCP,1504,80  >  2983 [ACK] Seq=1449 Ack=1 Win=33304 Len=1448[Packet size limited during capture]
1420,0.01918,238.57.159.133,243.214.199.24,TCP,1264,80  >  52144 [ACK] Seq=1 Ack=1 Win=24616 Len=1208[Packet size limited during capture]
1553,0.020671,69.88.197.172,115.32.35.236,TCP,919,"4662  >  2686 [PSH, ACK] Seq=1 Ack=1 Win=16072 Len=875[Packet size limited during capture]"
1688,0.023018,238.109.204.173,238.14.207.3,TCP,44,80  >  43668 [ACK] Seq=1 Ack=1 Win=6432 Len=0
1711,0.023331,3.3.241.154,227.126.99.3,TCP,124,"30828  >  2772 [PSH, ACK] Seq=1461 Ack=1 Win=8760 Len=80[Packet size limited during capture]"
1713,0.023356,3.3.241.154,227.126.99.3,TCP,1504,[TCP Retransmission] 30828  >  2772 [ACK] Seq=4294965837 Ack=1 Win=8760 Len=1460[Packet size limited during capture]
1814,0.024875,227.216.50.74,241.84.157.231,TCP,44,1997  >  80 [ACK] Seq=1 Ack=1 Win=16560 Len=0
1886,0.025695,71.197.196.229,164.34.212.15,TCP,44,1169  >  80 [ACK] Seq=1 Ack=2079 Win=17520 Len=0
1930,0.0262,227.139.62.114,4.14.19.109,TCP,44,66  >  2396 [ACK] Seq=1 Ack=1 Win=32767 Len=0
2086,0.028507,225.36.9.72,3.142.99.184,TCP,56,3469  >  80 [ACK] Seq=1 Ack=1 Win=65044 Len=0[Packet size limited during capture]
2224,0.030609,237.230.37.55,115.34.215.99,TCP,771,"2178  >  6699 [PSH, ACK] Seq=1 Ack=1 Win=8580 Len=727[Packet size limited during capture]"
2335,0.031902,0.168.5.105,238.109.212.180,TCP,44,"57346  >  80 [FIN, ACK] Seq=1 Ack=1909 Win=8280 Len=0"
2363,0.032264,237.105.47.241,241.8.40.37,TCP,1424,80  >  1170 [ACK] Seq=1 Ack=1 Win=6432 Len=1380
2502,0.033936,69.138.113.164,0.3.117.181,TCP,44,52838  >  80 [ACK] Seq=1 Ack=1 Win=17520 Len=0
2593,0.035323,224.71.61.185,236.33.247.143,TCP,44,4205  >  80 [ACK] Seq=1 Ack=1 Win=4288 Len=0
2602,0.035489,239.186.251.61,244.119.108.175,TCP,1504,80  >  1734 [ACK] Seq=1 Ack=1 Win=65535 Len=1460[Packet size limited during capture]
2723,0.036979,69.156.24.47,140.157.28.177,TCP,580,1578  >  1241 [ACK] Seq=537 Ack=1 Win=17520 Len=536[Packet size limited during capture]
2726,0.037005,237.57.104.96,143.165.207.29,TCP,586,"1149  >  6699 [PSH, ACK] Seq=1 Ack=1 Win=17520 Len=542[Packet size limited during capture]"
2780,0.037887,3.3.241.146,238.217.239.46,TCP,1504,[TCP Retransmission] 10350  >  6082 [ACK] Seq=4294965837 Ack=1 Win=8760 Len=1460[Packet size limited during capture]
2792,0.03816,3.3.241.146,238.217.239.46,TCP,1504,"10350  >  6082 [PSH, ACK] Seq=1461 Ack=1 Win=8760 Len=1460[Packet size limited during capture]"
3187,0.044017,3.3.241.137,243.149.161.205,TCP,1504,"10566  >  16414 [PSH, ACK] Seq=1 Ack=1 Win=8760 Len=1460[Packet size limited during capture]"
3222,0.04443,237.74.51.119,243.191.80.2,TCP,1504,[TCP Retransmission] 1755  >  39063 [ACK] Seq=4294965837 Ack=1 Win=17280 Len=1460[Packet size limited during capture]
3266,0.045361,157.193.226.36,238.14.134.222,TCP,52,"80  >  4846 [SYN, ACK] Seq=0 Ack=1 Win=5840 Len=0 MSS=1460[Packet size limited during capture]"
3351,0.046742,159.154.219.196,69.25.244.169,TCP,1200,"80  >  4678 [FIN, ACK] Seq=4345 Ack=1 Win=33304 Len=1144[Packet size limited during capture]"
3382,0.047316,4.96.190.239,0.3.117.47,TCP,44,4693  >  80 [ACK] Seq=1 Ack=1 Win=65535 Len=0
3520,0.048996,236.140.204.151,162.131.175.224,TCP,44,3122  >  8080 [ACK] Seq=1 Ack=1 Win=8760 Len=0
3604,0.050015,69.241.53.250,244.176.131.35,FTP-DATA,1504,FTP Data: 1460 bytes
3677,0.051021,225.207.236.198,241.46.212.25,TCP,44,1084  >  28914 [ACK] Seq=1 Ack=1 Win=8276 Len=0
3727,0.051707,3.197.162.130,227.212.58.164,TCP,44,59974  >  1214 [ACK] Seq=1 Ack=1 Win=17520 Len=0
3758,0.052249,69.110.153.212,3.130.128.129,TCP,1458,1214  >  3439 [ACK] Seq=1 Ack=1 Win=16633 Len=1414[Packet size limited during capture]
3822,0.052906,3.226.250.30,140.133.58.39,TCP,44,2195  >  80 [ACK] Seq=1 Ack=1 Win=16932 Len=0
3919,0.05428,3.3.241.136,227.9.189.140,TCP,1444,[TCP Retransmission] 10646  >  1101 [ACK] Seq=1401 Ack=1 Win=8760 Len=1400[Packet size limited during capture]
4089,0.056826,0.121.193.213,3.13.73.143,TCP,1504,80  >  3811 [ACK] Seq=10221 Ack=1 Win=13936 Len=1460
4331,0.060639,225.26.166.94,115.51.212.37,TCP,44,2064  >  4662 [ACK] Seq=1 Ack=1 Win=17520 Len=0
4340,0.060757,0.2.253.224,1.44.202.231,TCP,1368,"80  >  62220 [PSH, ACK] Seq=1415 Ack=1 Win=25452 Len=1324[Packet size limited during capture]"
4417,0.061836,237.134.72.240,162.139.205.253,TCP,44,1813  >  3128 [ACK] Seq=1 Ack=1236 Win=47918 Len=0
4466,0.062528,157.193.227.112,157.202.195.188,TCP,580,80  >  1703 [ACK] Seq=1 Ack=1 Win=57352 Len=536
4472,0.062655,4.80.176.55,227.212.212.118,TCP,44,4216  >  1214 [ACK] Seq=1 Ack=1 Win=64029 Len=0
4730,0.066232,227.247.64.2,1.46.70.12,TCP,1504,8080  >  1364 [ACK] Seq=10221 Ack=1 Win=32120 Len=1460[Packet size limited during capture]
4777,0.06699,241.38.75.203,3.176.6.108,TCP,1081,"80  >  64760 [PSH, ACK] Seq=1461 Ack=1 Win=16670 Len=1037[Packet size limited during capture]"
4899,0.068864,3.82.80.32,238.109.212.178,TCP,56,1056  >  80 [ACK] Seq=1 Ack=1 Win=16560 Len=0[Packet size limited during capture]
5029,0.070619,236.242.36.251,0.61.219.228,UDP,68,30814  >  39038 Len=36
5034,0.070688,237.44.160.128,115.52.2.108,TCP,1100,"2166  >  6699 [PSH, ACK] Seq=1 Ack=1 Win=65253 Len=1056[Packet size limited during capture]"
5061,0.07119,239.83.231.58,238.109.212.178,TCP,44,1984  >  80 [ACK] Seq=1 Ack=1 Win=16560 Len=0
5160,0.072443,241.216.24.145,0.3.118.203,TCP,56,48435  >  2612 [ACK] Seq=1 Ack=5793 Win=63712 Len=0[Packet size limited during capture]
5227,0.073117,3.43.183.133,162.131.225.164,TCP,44,[TCP Dup ACK 5226#1] 80  >  43126 [ACK] Seq=1 Ack=1 Win=6432 Len=0
5465,0.076433,227.247.112.199,227.186.102.37,SMTP,153,S: 550 
5586,0.078237,227.139.62.94,227.125.55.166,TCP,580,80  >  1627 [ACK] Seq=1 Ack=1 Win=7504 Len=536
5657,0.079173,0.3.168.217,243.243.204.1,DNS,121,Standard query response 0xb73b[Packet size limited during capture]
5709,0.079758,0.2.254.16,1.44.85.203,TCP,1330,"80  >  1664 [PSH, ACK] Seq=1453 Ack=1 Win=24684 Len=1286[Packet size limited during capture]"
5792,0.080713,237.222.48.46,115.48.200.8,RTCP,44,Extended report (RFC 3611)   [Malformed Packet]
5868,0.081824,237.221.22.118,115.40.220.12,TCP,44,2936  >  80 [ACK] Seq=1 Ack=1 Win=8760 Len=0
5897,0.082357,239.187.112.86,249.73.254.141,TCP,52,"80  >  55545 [SYN, ACK] Seq=0 Ack=1 Win=5840 Len=0 MSS=1460[Packet size limited during capture]"
6299,0.087999,0.2.255.196,227.35.100.29,TCP,1504,80  >  42472 [ACK] Seq=1 Ack=1 Win=24820 Len=1460
6425,0.089478,3.248.26.252,3.131.145.253,TCP,1496,80  >  57344 [ACK] Seq=4357 Ack=1 Win=65535 Len=1452
6451,0.0899,3.3.5.152,3.12.11.59,TCP,246,"1755  >  1552 [PSH, ACK] Seq=1 Ack=1 Win=16706 Len=202[Packet size limited during capture]"
6506,0.090492,3.150.43.198,236.67.148.248,TCP,64,55806  >  21 [SYN] Seq=0 Win=5840 Len=0 MSS=1460[Packet size limited during capture]
6710,0.093119,227.247.64.2,173.151.152.30,TCP,1504,8080  >  43502 [ACK] Seq=13141 Ack=1 Win=32120 Len=1460[Packet size limited during capture]
6991,0.097159,1.78.246.60,162.131.66.6,TCP,803,"80  >  47173 [PSH, ACK] Seq=1 Ack=1 Win=17520 Len=747[Packet size limited during capture]"
6993,0.097194,71.209.135.43,162.131.199.254,TCP,1504,80  >  18175 [ACK] Seq=4345 Ack=1 Win=32120 Len=1448[Packet size limited during capture]
7054,0.097981,237.77.210.8,115.45.247.184,TCP,60,"4576  >  6699 [PSH, ACK] Seq=1 Ack=1 Win=17520 Len=16"
7151,0.099206,3.150.43.198,236.67.148.240,TCP,64,55820  >  21 [SYN] Seq=0 Win=5840 Len=0 MSS=1460[Packet size limited during capture]
7296,0.100639,3.150.43.198,236.67.148.220,TCP,64,55840  >  21 [SYN] Seq=0 Win=5840 Len=0 MSS=1460[Packet size limited during capture]
7346,0.100998,244.97.76.229,162.131.209.252,TCP,580,80  >  34913 [ACK] Seq=17993 Ack=1 Win=8576 Len=536[Packet size limited during capture]
7413,0.101756,239.187.83.164,244.129.248.170,TCP,52,"80  >  1965 [SYN, ACK] Seq=0 Ack=1 Win=32120 Len=0 MSS=1460[Packet size limited during capture]"
7429,0.101887,3.95.117.102,162.140.101.233,TCP,580,80  >  1277 [ACK] Seq=1 Ack=1 Win=16616 Len=536[Packet size limited during capture]
7464,0.102321,244.97.76.229,162.131.209.252,TCP,580,80  >  34913 [ACK] Seq=22281 Ack=1 Win=8576 Len=536
7536,0.103036,0.3.186.171,3.130.133.191,TCP,1404,"80  >  1139 [PSH, ACK] Seq=1349 Ack=1 Win=32640 Len=1348[Packet size limited during capture]"
7687,0.104824,227.139.42.64,115.204.119.55,TCP,1504,"80  >  4714 [PSH, ACK] Seq=2921 Ack=1 Win=32120 Len=1460"
7774,0.105831,69.75.51.85,3.96.146.249,TCP,801,"6699  >  1172 [PSH, ACK] Seq=1 Ack=1 Win=48180 Len=757[Packet size limited during capture]"
7991,0.108428,69.96.50.74,0.180.224.252,Gearman,248,"[MGR] \357\277\275,R\357\277\275"
8020,0.108695,115.170.0.201,0.3.117.70,TCP,44,1078  >  80 [ACK] Seq=1 Ack=1 Win=16475 Len=0
8024,0.108751,3.150.43.198,236.67.149.58,TCP,64,55928  >  21 [SYN] Seq=0 Win=5840 Len=0 MSS=1460[Packet size limited during capture]
8045,0.108978,0.2.254.188,227.95.148.2,TCP,1504,80  >  39625 [ACK] Seq=4294965849 Ack=1 Win=24616 Len=1448[Packet size limited during capture]
8185,0.110677,162.76.163.84,0.180.230.101,TCP,44,1214  >  4421 [ACK] Seq=1 Ack=1 Win=16398 Len=0
8301,0.111926,3.3.2.184,238.102.225.220,TCP,56,"4768  >  80 [FIN, ACK] Seq=1 Ack=59 Win=65535 Len=0[Packet size limited during capture]"
8470,0.114001,252.227.244.174,243.160.16.7,DNS,139,Standard query response 0x5c67[Packet size limited during capture]
8655,0.116376,236.170.101.81,241.201.117.144,TCP,52,2523  >  80 [SYN] Seq=0 Win=23360 Len=0 MSS=1460[Packet size limited during capture]
8659,0.116429,243.27.115.204,241.46.237.40,TCP,44,1119  >  80 [ACK] Seq=1 Ack=1 Win=64860 Len=0
8682,0.11674,227.247.15.149,240.39.221.47,TCP,1504,"[TCP Retransmission] 2189  >  1142 [PSH, ACK] Seq=4294965837 Ack=1 Win=7395 Len=1460[Packet size limited during capture]"
8688,0.116881,227.247.180.177,115.33.109.203,TCP,164,"2189  >  1108 [PSH, ACK] Seq=1 Ack=1 Win=8487 Len=120[Packet size limited during capture]"
8718,0.117247,1.78.241.105,238.109.212.228,TCP,183,"25  >  2770 [PSH, ACK] Seq=1 Ack=1 Win=16616 Len=127[Packet size limited during capture]"
8761,0.117982,0.63.76.239,227.195.70.63,TCP,44,"80  >  1113 [FIN, ACK] Seq=1 Ack=1 Win=24656 Len=0"
8986,0.120236,237.179.4.164,115.47.43.246,TCP,52,"6699  >  65084 [PSH, ACK] Seq=1 Ack=1 Win=8760 Len=8"
9096,0.121798,3.248.179.240,3.131.88.67,IPv4,215,"Fragmented IP protocol (proto=UDP 17, off=1480, ID=26a1)"
9098,0.12185,227.247.100.73,3.142.97.48,TCP,1504,80  >  4649 [ACK] Seq=1 Ack=22 Win=17520 Len=1460[Packet size limited during capture]
9194,0.123097,3.3.155.79,236.64.95.252,TCP,44,1323  >  80 [ACK] Seq=1 Ack=1 Win=17118 Len=0
9222,0.123554,3.3.115.145,2.164.30.234,TCP,1504,80  >  2299 [ACK] Seq=10545 Ack=1 Win=24820 Len=1460
9238,0.123736,237.241.216.70,241.46.218.121,TCP,44,1343  >  80 [ACK] Seq=1 Ack=2921 Win=64240 Len=0
9715,0.129562,237.22.33.235,227.137.183.227,TCP,445,"65479  >  80 [PSH, ACK] Seq=1 Ack=1 Win=65535 Len=389[Packet size limited during capture]"
9738,0.129952,3.248.179.244,3.131.87.58,TCP,825,"1755  >  17328 [PSH, ACK] Seq=1 Ack=1 Win=16562 Len=781[Packet size limited during capture]"
9799,0.130826,69.59.59.196,0.180.4.226,TCP,359,"4662  >  4611 [PSH, ACK] Seq=626 Ack=4326 Win=17280 Len=315[Packet size limited during capture]"
9862,0.131982,238.45.232.6,2.164.22.178,TCP,1504,80  >  16771 [ACK] Seq=11681 Ack=1 Win=6432 Len=1460
9955,0.133192,3.248.121.134,115.12.162.71,TCP,1504,4923  >  6346 [ACK] Seq=732 Ack=6351 Win=33304 Len=1448[Packet size limited during capture]
10036,0.134151,3.3.242.130,69.1.126.199,TCP,52,"80  >  2752 [SYN, ACK] Seq=0 Ack=1 Win=5840 Len=0 MSS=1460[Packet size limited during capture]"
10050,0.134462,238.129.41.54,140.140.251.253,DNS,273,Standard query response 0xe45b[Packet size limited during capture]
10121,0.135316,115.203.92.162,0.3.117.50,TCP,52,2911  >  80 [SYN] Seq=0 Win=8192 Len=0 MSS=1460[Packet size limited during capture]
10281,0.137528,244.97.76.229,162.131.209.252,TCP,580,80  >  34913 [ACK] Seq=26185 Ack=1 Win=8576 Len=536[Packet size limited during capture]
10407,0.138914,3.150.43.198,236.67.149.248,TCP,64,56003  >  21 [SYN] Seq=0 Win=5840 Len=0 MSS=1460[Packet size limited during capture]
10465,0.139664,87.231.23.201,162.139.205.253,TCP,44,4094  >  3128 [ACK] Seq=1 Ack=1 Win=17520 Len=0
10617,0.141695,0.157.132.109,238.109.212.239,TCP,56,25  >  2897 [ACK] Seq=242 Ack=11144 Win=65500 Len=0[Packet size limited during capture]
10677,0.142231,245.137.158.150,162.131.209.252,TCP,44,"[TCP Previous segment not captured] 80  >  40770 [FIN, ACK] Seq=486 Ack=1 Win=32120 Len=0"
10788,0.143834,3.3.241.146,238.217.239.46,TCP,1504,[TCP Retransmission] 10350  >  6082 [ACK] Seq=2921 Ack=1 Win=8760 Len=1460[Packet size limited during capture]
10849,0.144725,69.241.53.178,236.245.38.52,TCP,269,"5001  >  3391 [PSH, ACK] Seq=1 Ack=1 Win=15861 Len=225[Packet size limited during capture]"
10957,0.146128,3.3.241.155,2.167.223.187,TCP,1204,"30138  >  8478 [PSH, ACK] Seq=1 Ack=1 Win=8760 Len=1160[Packet size limited during capture]"
10969,0.146285,227.247.98.231,3.142.98.83,TCP,56,80  >  4977 [ACK] Seq=1 Ack=131 Win=33304 Len=0[Packet size limited during capture]
10970,0.146322,0.2.254.93,143.69.82.193,TCP,586,"80  >  1301 [PSH, ACK] Seq=1 Ack=1 Win=25848 Len=542"
11122,0.148427,227.247.165.153,227.212.126.104,TCP,348,"2189  >  1031 [PSH, ACK] Seq=1 Ack=1 Win=7880 Len=304[Packet size limited during capture]"
11320,0.150831,237.21.36.63,0.3.117.180,TCP,44,2318  >  80 [ACK] Seq=1 Ack=2921 Win=8760 Len=0
12010,0.160293,227.179.55.245,143.69.106.160,TCP,261,"80  >  1159 [PSH, ACK] Seq=1 Ack=1 Win=6432 Len=217[Packet size limited during capture]"
12246,0.163164,239.187.83.185,115.49.252.97,TCP,817,"1755  >  3832 [PSH, ACK] Seq=6614 Ack=1 Win=16752 Len=773[Packet size limited during capture]"
12259,0.163324,1.174.191.108,140.136.233.233,TCP,1504,80  >  2071 [ACK] Seq=2921 Ack=1 Win=32120 Len=1460
12285,0.163642,239.187.112.86,238.88.132.79,TCP,580,80  >  1463 [ACK] Seq=537 Ack=1 Win=6432 Len=536[Packet size limited during capture]
12293,0.163692,236.123.28.38,242.5.13.158,TCP,44,6699  >  3493 [ACK] Seq=9 Ack=621 Win=64915 Len=0
12316,0.164034,237.225.129.140,115.42.247.74,TCP,1504,8000  >  32476 [ACK] Seq=1 Ack=1 Win=17520 Len=1460[Packet size limited during capture]
12378,0.16478,69.252.247.228,0.3.117.181,TCP,56,3045  >  80 [ACK] Seq=1 Ack=1 Win=31856 Len=0[Packet size limited during capture]
12433,0.165769,3.3.241.157,3.58.101.171,TCP,1412,[TCP Previous segment not captured] 10204  >  1684 [ACK] Seq=4265 Ack=1 Win=9576 Len=1368[Packet size limited during capture]
12609,0.168326,245.50.53.244,0.3.117.180,TCP,44,3669  >  80 [ACK] Seq=1 Ack=11681 Win=17520 Len=0
12748,0.16995,69.100.180.94,3.176.187.198,TCP,241,"2000  >  1043 [PSH, ACK] Seq=1 Ack=1 Win=16814 Len=197[Packet size limited during capture]"
12787,0.170478,3.3.131.245,238.15.182.4,TCP,556,80  >  1032 [ACK] Seq=1 Ack=1 Win=24576 Len=512
12823,0.170937,157.193.227.112,157.202.195.188,TCP,580,80  >  1703 [ACK] Seq=537 Ack=1 Win=57352 Len=536[Packet size limited during capture]
12903,0.172008,238.110.28.234,227.221.235.123,TCP,1104,[TCP Previous segment not captured] 510  >  15485 [ACK] Seq=8481 Ack=1 Win=17520 Len=1060[Packet size limited during capture]
12942,0.17272,239.187.83.162,249.161.225.198,TCP,44,51264  >  80 [ACK] Seq=170 Ack=29962 Win=21900 Len=0
12974,0.173048,3.196.40.131,162.137.10.39,TCP,1504,80  >  1544 [ACK] Seq=1 Ack=1 Win=17520 Len=1460[Packet size limited during capture]
12984,0.173144,227.231.32.58,161.187.186.19,TCP,44,80  >  1234 [ACK] Seq=1 Ack=1 Win=31824 Len=0
13038,0.173713,0.63.102.100,107.18.226.123,TCP,1504,"80  >  6142 [PSH, ACK] Seq=23169 Ack=1 Win=31856 Len=1448[Packet size limited during capture]"
13149,0.175103,3.3.120.122,239.66.108.246,TCP,1458,80  >  2010 [ACK] Seq=19797 Ack=1 Win=16146 Len=1414
13306,0.177087,225.201.120.230,241.46.219.188,TCP,56,4907  >  80 [ACK] Seq=1 Ack=5841 Win=17520 Len=0[Packet size limited during capture]
13374,0.178249,227.139.14.161,238.14.220.192,TCP,580,80  >  1841 [ACK] Seq=537 Ack=1 Win=6432 Len=536
13555,0.180351,3.3.49.46,69.1.53.24,TCP,580,80  >  65024 [ACK] Seq=525 Ack=1 Win=33012 Len=524[Packet size limited during capture]
13611,0.181203,3.172.0.22,227.198.144.208,TCP,44,3658  >  80 [ACK] Seq=1 Ack=2 Win=16560 Len=0
13622,0.181438,249.136.206.74,3.176.200.165,TCP,44,58696  >  6348 [ACK] Seq=1 Ack=1 Win=32679 Len=0
13640,0.181705,225.203.161.126,241.46.185.161,TCP,44,2731  >  80 [RST] Seq=1 Win=0 Len=0
13904,0.184983,3.195.250.22,3.12.185.207,TCP,44,80  >  21169 [ACK] Seq=1 Ack=282 Win=6656 Len=0
13997,0.186542,3.248.26.37,1.47.42.217,TCP,309,"6347  >  2896 [PSH, ACK] Seq=1 Ack=1 Win=58080 Len=265[Packet size limited during capture]"
14063,0.187334,244.238.113.164,241.8.239.100,TCP,44,1115  >  6699 [ACK] Seq=9 Ack=621 Win=8140 Len=0
14073,0.187429,227.231.29.176,115.227.168.25,TCP,44,80  >  13098 [ACK] Seq=219 Ack=2 Win=32120 Len=0
14081,0.187603,237.231.34.227,115.32.208.131,TCP,64,4662  >  4243 [ACK] Seq=1 Ack=1 Win=7860 Len=0[Packet size limited during capture]
14131,0.188263,236.227.183.230,241.46.218.115,TCP,132,"13910  >  80 [PSH, ACK] Seq=605 Ack=1 Win=17520 Len=76[Packet size limited during capture]"
14138,0.188319,237.13.241.245,115.40.66.175,TCP,1220,"1076  >  6699 [PSH, ACK] Seq=11113 Ack=1 Win=23358 Len=1176[Packet size limited during capture]"
14171,0.188639,245.58.53.125,0.3.117.180,TCP,44,4630  >  80 [ACK] Seq=1 Ack=1 Win=8760 Len=0
14227,0.189306,239.187.74.45,238.181.227.206,TCP,52,"80  >  1193 [SYN, ACK] Seq=0 Ack=1 Win=5840 Len=0 MSS=1460[Packet size limited during capture]"
14268,0.189946,225.101.182.3,162.132.78.141,HTTP,103,Continuation[Packet size limited during capture]
14270,0.189962,244.209.179.152,115.33.235.168,TCP,44,3067  >  6699 [ACK] Seq=1 Ack=5365 Win=15700 Len=0
14361,0.191157,3.195.251.45,3.170.242.65,UDP,104,1716  >  4587 Len=72
14436,0.192047,238.223.139.242,115.32.223.90,UDP,642,7860  >  6972 Len=610
14608,0.194106,239.186.68.138,3.231.230.106,TCP,1504,80  >  4573 [ACK] Seq=1461 Ack=1 Win=58400 Len=1460[Packet size limited during capture]
14843,0.196992,3.248.26.239,227.127.26.221,TCP,48,"80  >  1944 [SYN, ACK] Seq=0 Ack=1 Win=65535 Len=0 MSS=1460"
14886,0.197402,159.154.217.232,2.166.81.233,UDP,764,12203  >  12203 Len=732
14931,0.197981,3.150.43.198,236.67.149.158,TCP,64,56100  >  21 [SYN] Seq=0 Win=5840 Len=0 MSS=1460[Packet size limited during capture]
15027,0.199271,227.247.15.153,1.44.208.36,TCP,122,"2189  >  1034 [PSH, ACK] Seq=92 Ack=1 Win=7685 Len=78[Packet size limited during capture]"
15104,0.200376,237.237.3.240,238.180.135.208,TCP,710,"6699  >  64462 [PSH, ACK] Seq=1415 Ack=1 Win=15688 Len=666[Packet size limited during capture]"
15276,0.202782,3.3.5.145,248.50.245.58,TCP,1424,[TCP Retransmission] 1755  >  64126 [ACK] Seq=4294964537 Ack=1 Win=15600 Len=1380[Packet size limited during capture]
15302,0.203275,71.197.196.229,164.34.212.15,TCP,44,1169  >  80 [ACK] Seq=352 Ack=4999 Win=17520 Len=0
15320,0.203643,3.3.132.7,3.130.21.154,TCP,1504,80  >  4092 [ACK] Seq=21901 Ack=1 Win=65535 Len=1460
15513,0.206328,227.247.110.67,1.36.41.29,TCP,1424,80  >  1422 [ACK] Seq=4141 Ack=1 Win=63891 Len=1380
15697,0.208514,238.57.42.32,241.110.64.60,TCP,1424,80  >  8256 [ACK] Seq=66917 Ack=1 Win=29063 Len=1380[Packet size limited during capture]
15887,0.211013,227.216.50.74,241.84.157.231,TCP,44,2004  >  80 [ACK] Seq=428 Ack=215 Win=16347 Len=0
15921,0.211454,237.249.146.254,3.96.154.61,UDP,67,1214  >  1214 Len=35
15972,0.212118,237.222.109.173,115.49.122.51,TCP,100,"4021  >  2171 [PSH, ACK] Seq=1 Ack=1 Win=40550 Len=44[Packet size limited during capture]"
16039,0.213123,3.3.128.162,227.186.113.125,TCP,1504,80  >  4837 [ACK] Seq=4381 Ack=1 Win=17170 Len=1460[Packet size limited during capture]
16081,0.213649,243.144.2.20,0.3.117.37,TCP,44,"47799  >  80 [FIN, ACK] Seq=370 Ack=310 Win=33580 Len=0"
16093,0.213814,0.2.255.195,115.53.33.213,TCP,1504,[TCP Retransmission] 80  >  3586 [ACK] Seq=4294965837 Ack=1 Win=24820 Len=1460
16248,0.216261,238.109.233.231,137.142.241.173,TCP,44,"80  >  1043 [FIN, ACK] Seq=1 Ack=1 Win=16080 Len=0"
16409,0.218146,3.150.43.198,236.67.150.18,TCP,64,56145  >  21 [SYN] Seq=0 Win=5840 Len=0 MSS=1460[Packet size limited during capture]
16488,0.219121,3.208.96.239,252.136.109.244,TCP,1504,80  >  41573 [ACK] Seq=36501 Ack=1 Win=6432 Len=1460
16507,0.219347,236.35.204.78,0.3.117.181,TCP,44,62718  >  80 [ACK] Seq=1 Ack=2921 Win=17520 Len=0
16557,0.220081,227.231.11.183,238.26.109.238,TCP,580,80  >  1201 [ACK] Seq=537 Ack=1 Win=6432 Len=536[Packet size limited during capture]
16676,0.221981,227.247.110.67,4.114.166.165,TCP,52,"80  >  3483 [SYN, ACK] Seq=0 Ack=1 Win=64240 Len=0 MSS=1380[Packet size limited during capture]"
16700,0.222545,238.83.225.232,238.116.229.0,TCP,93,"3277  >  1056 [PSH, ACK] Seq=1 Ack=1 Win=16564 Len=49[Packet size limited during capture]"
16813,0.224387,238.255.72.240,3.131.65.229,TCP,580,80  >  2167 [ACK] Seq=1 Ack=1 Win=16616 Len=536[Packet size limited during capture]
17000,0.226726,69.10.138.3,140.141.156.187,TCP,56,57404  >  80 [ACK] Seq=1 Ack=1 Win=17520 Len=0[Packet size limited during capture]
17064,0.22762,236.147.153.190,161.187.19.247,DNS,540,Standard query response 0x42ff[Packet size limited during capture]
17238,0.229387,71.61.184.22,238.109.212.180,TCP,44,1153  >  80 [ACK] Seq=1 Ack=390 Win=8576 Len=0
17283,0.22987,237.228.234.248,115.53.246.234,TCP,347,"6699  >  1278 [PSH, ACK] Seq=1062 Ack=965 Win=64111 Len=303[Packet size limited during capture]"
17539,0.233484,0.3.198.213,249.241.103.137,TCP,247,"1755  >  3257 [PSH, ACK] Seq=1461 Ack=1 Win=16320 Len=203[Packet size limited during capture]"
17647,0.234881,225.205.225.217,115.35.165.178,UDP,166,5555  >  5555 Len=134
17898,0.238021,240.23.166.16,238.109.212.180,TCP,44,1108  >  80 [ACK] Seq=1 Ack=1 Win=8280 Len=0
18008,0.23917,237.45.178.14,115.42.247.76,TCP,56,80  >  1626 [ACK] Seq=218 Ack=1 Win=7504 Len=0[Packet size limited during capture]
18043,0.239597,225.36.49.66,162.131.190.52,TCP,1456,8000  >  24197 [ACK] Seq=5496 Ack=1 Win=5608 Len=1400[Packet size limited during capture]
18093,0.240155,225.253.65.112,140.157.253.15,TCP,44,4662  >  1237 [ACK] Seq=1 Ack=1 Win=8484 Len=0
18207,0.241637,237.254.185.184,239.80.52.25,TCP,52,1147  >  443 [SYN] Seq=0 Win=8192 Len=0 MSS=1430[Packet size limited during capture]
18280,0.242585,3.248.6.35,227.9.133.123,TCP,524,"[TCP Retransmission] 7070  >  40340 [PSH, ACK] Seq=4294966817 Ack=1 Win=15994 Len=480[Packet size limited during capture]"
18374,0.243945,245.213.251.114,3.176.97.141,TCP,1424,"54260  >  4662 [PSH, ACK] Seq=491 Ack=1 Win=16100 Len=1380[Packet size limited during capture]"
18394,0.244224,129.153.168.27,143.173.19.151,UDP,1442,1214  >  1214 Len=1410
18476,0.245167,107.37.204.4,0.3.167.139,TCP,44,36432  >  443 [ACK] Seq=1 Ack=1 Win=16414 Len=0
18507,0.245496,0.3.207.230,239.244.243.52,TCP,1504,80  >  41655 [ACK] Seq=7301 Ack=1 Win=17055 Len=1460[Packet size limited during capture]
18565,0.246318,0.2.254.143,1.169.223.76,TCP,1504,[TCP Retransmission] 80  >  12880 [ACK] Seq=4294965837 Ack=1 Win=24820 Len=1460
18635,0.247312,239.186.52.2,0.2.64.97,DNS,200,Standard query response 0x74c4[Packet size limited during capture]
18869,0.250262,1.207.63.48,0.3.117.180,TCP,44,2939  >  80 [ACK] Seq=1 Ack=1381 Win=8280 Len=0
18901,0.250647,239.187.118.128,2.164.203.94,TCP,1484,80  >  3521 [ACK] Seq=2881 Ack=1 Win=6432 Len=1440[Packet size limited during capture]
18959,0.251444,0.3.83.61,248.175.37.23,TCP,1504,80  >  20156 [ACK] Seq=13704 Ack=1 Win=33580 Len=1460[Packet size limited during capture]
19039,0.252643,237.246.70.208,115.34.223.131,UDP,50,1224  >  1070 Len=18
19094,0.253525,243.183.175.251,0.3.118.236,TCP,588,"80  >  45966 [PSH, ACK] Seq=1992 Ack=235 Win=32120 Len=532[Packet size limited during capture]"
19109,0.253749,3.248.179.240,249.161.134.221,TCP,1424,[TCP Retransmission] 80  >  2526 [ACK] Seq=4294965917 Ack=1 Win=16211 Len=1380[Packet size limited during capture]
19115,0.253808,239.186.251.61,236.206.165.165,TCP,44,"80  >  1882 [FIN, ACK] Seq=449 Ack=1 Win=6809 Len=0"
19152,0.254372,225.200.64.236,241.46.185.161,TCP,52,1068  >  80 [SYN] Seq=0 Win=16384 Len=0 MSS=1460[Packet size limited during capture]
19177,0.254732,3.196.38.59,236.32.18.170,UDP,112,5000  >  5000 Len=80
19416,0.257872,236.227.183.232,241.46.218.115,TCP,68,56927  >  80 [SYN] Seq=0 Win=16384 Len=0 MSS=1460[Packet size limited during capture]
19533,0.259134,227.247.64.2,173.151.152.30,TCP,1504,8080  >  43502 [ACK] Seq=35041 Ack=1 Win=32120 Len=1460[Packet size limited during capture]
19610,0.259822,1.9.201.202,140.136.73.188,TCP,1504,"80  >  3676 [PSH, ACK] Seq=2921 Ack=1 Win=32120 Len=1460[Packet size limited during capture]"
19619,0.259889,238.57.42.32,241.110.64.60,TCP,1336,"80  >  8256 [PSH, ACK] Seq=88821 Ack=1 Win=29063 Len=1292[Packet size limited during capture]"
19656,0.26032,239.186.70.252,0.180.62.94,TCP,1504,80  >  4905 [ACK] Seq=7301 Ack=1 Win=58400 Len=1460[Packet size limited during capture]
19710,0.260936,0.85.84.144,238.109.212.154,DNS,238,Standard query response 0x2b95[Packet size limited during capture]
19876,0.263353,239.187.83.162,249.161.225.198,TCP,44,[TCP Window Update] 51264  >  80 [ACK] Seq=170 Ack=57813 Win=29200 Len=0
20160,0.266964,237.228.190.38,115.34.62.56,TCP,44,1055  >  6699 [ACK] Seq=359 Ack=3112 Win=17520 Len=0
20430,0.269993,0.2.254.189,115.45.249.71,TCP,562,"80  >  4204 [PSH, ACK] Seq=1 Ack=1 Win=24820 Len=518"
20474,0.270464,0.63.102.90,238.181.89.195,TCP,360,"22  >  32543 [PSH, ACK] Seq=145 Ack=1 Win=57920 Len=304[Packet size limited during capture]"
20733,0.273634,3.3.186.247,238.47.189.180,TCP,1463,"80  >  3262 [FIN, PSH, ACK] Seq=2921 Ack=1 Win=6432 Len=1419[Packet size limited during capture]"
20776,0.274226,3.3.153.8,3.131.62.52,TCP,556,1114  >  1036 [ACK] Seq=4097 Ack=1 Win=63903 Len=512[Packet size limited during capture]
20833,0.274887,236.242.36.251,0.61.200.67,UDP,68,30820  >  21256 Len=36
21118,0.27843,3.74.253.190,107.32.62.4,TCP,44,1447  >  80 [ACK] Seq=1 Ack=1 Win=8576 Len=0
21220,0.279618,3.150.43.198,236.67.151.193,TCP,64,56412  >  21 [SYN] Seq=0 Win=5840 Len=0 MSS=1460[Packet size limited during capture]
21296,0.280708,227.209.163.65,227.212.130.194,TCP,44,80  >  50947 [ACK] Seq=1 Ack=153 Win=30660 Len=0
21407,0.281959,225.21.143.170,3.223.149.14,TCP,44,65407  >  80 [ACK] Seq=1 Ack=4097 Win=48180 Len=0
21426,0.282184,225.212.79.143,0.61.199.67,TCP,44,63038  >  80 [ACK] Seq=1 Ack=14601 Win=17520 Len=0
21472,0.282723,3.195.251.57,244.188.230.150,UDP,53,1716  >  3309 Len=21
21593,0.284407,69.4.145.139,162.131.189.129,TCP,44,[TCP Dup ACK 21357#1] 3870  >  80 [ACK] Seq=1 Ack=1 Win=17520 Len=0
21620,0.284677,227.38.14.226,162.131.209.252,TCP,580,[TCP Retransmission] 80  >  40788 [ACK] Seq=1 Ack=1176 Win=17520 Len=536[Packet size limited during capture]
21707,0.285852,69.4.145.139,162.131.189.129,TCP,52,3047  >  80 [SYN] Seq=0 Win=16384 Len=0 MSS=1460[Packet size limited during capture]
21828,0.287586,0.3.220.134,71.16.224.247,TCP,300,"13130  >  3941 [PSH, ACK] Seq=928 Ack=559 Win=32120 Len=244[Packet size limited during capture]"
21905,0.28833,3.150.43.198,236.67.151.147,TCP,64,56489  >  21 [SYN] Seq=0 Win=5840 Len=0 MSS=1460[Packet size limited during capture]
22050,0.290072,3.3.168.249,1.44.47.158,TCP,1484,80  >  4046 [ACK] Seq=2881 Ack=505 Win=17280 Len=1440
22082,0.290464,237.221.132.49,115.51.181.22,TCP,52,"6699  >  3106 [PSH, ACK] Seq=25 Ack=7701 Win=8760 Len=8"
22286,0.292948,227.216.50.74,241.84.157.231,TCP,44,2008  >  80 [ACK] Seq=1 Ack=1 Win=16560 Len=0
22427,0.295109,69.230.96.159,241.46.185.161,TCP,44,60201  >  80 [RST] Seq=1 Win=0 Len=0
22480,0.295869,0.3.207.230,71.199.27.2,TCP,1504,80  >  36679 [ACK] Seq=5841 Ack=1 Win=17040 Len=1460[Packet size limited during capture]
22493,0.295981,239.187.83.154,115.35.26.187,TCP,52,"80  >  5216 [SYN, ACK] Seq=0 Ack=1 Win=32120 Len=0 MSS=1460[Packet size limited during capture]"
22539,0.296626,0.63.90.130,249.192.133.187,TCP,1504,80  >  4044 [ACK] Seq=13033 Ack=1 Win=6432 Len=1448[Packet size limited during capture]
22540,0.296646,244.224.38.26,162.131.189.129,TCP,44,2659  >  8080 [ACK] Seq=1 Ack=2921 Win=8760 Len=0
22833,0.299849,3.248.96.252,239.65.239.142,TCP,1504,80  >  3830 [ACK] Seq=27741 Ack=1 Win=65535 Len=1460
22849,0.300035,107.113.58.138,238.109.212.180,TCP,44,"1086  >  80 [FIN, ACK] Seq=1 Ack=953 Win=8576 Len=0"
22876,0.300337,237.227.156.119,140.157.168.43,TCP,124,"65254  >  4662 [PSH, ACK] Seq=2921 Ack=1 Win=62838 Len=80[Packet size limited during capture]"
23286,0.305326,224.52.67.80,115.32.56.239,UDP,1504,4928  >  3317 Len=3208
23413,0.307121,239.187.118.128,2.164.143.238,TCP,1458,80  >  3110 [ACK] Seq=31109 Ack=1 Win=6432 Len=1414
23620,0.310034,3.3.120.122,3.131.81.189,TCP,1484,80  >  4355 [ACK] Seq=15841 Ack=1 Win=16381 Len=1440[Packet size limited during capture]
23658,0.31049,237.85.125.190,238.180.227.170,TCP,1496,4662  >  14705 [ACK] Seq=4362 Ack=1 Win=15860 Len=1452[Packet size limited during capture]
23674,0.310732,3.210.35.85,238.240.203.42,TCP,1504,8000  >  1557 [ACK] Seq=1025 Ack=1 Win=5840 Len=1460[Packet size limited during capture]
23683,0.310843,3.195.251.90,3.191.7.222,UDP,104,1716  >  3015 Len=72
23713,0.311243,3.3.184.22,3.58.65.21,UDP,218,27017  >  27005 Len=186
23723,0.311323,69.4.145.139,162.131.189.129,TCP,44,[TCP Dup ACK 876#1] 3996  >  80 [ACK] Seq=1 Ack=1 Win=17520 Len=0
23842,0.312838,244.209.83.215,241.84.142.178,HTTP,997,Continuation[Packet size limited during capture]
23878,0.313366,239.187.118.128,238.240.225.47,TCP,1504,80  >  4471 [ACK] Seq=24821 Ack=1 Win=6432 Len=1460
23894,0.313506,137.175.105.239,227.29.11.127,DNS,61,Standard query 0xfc26[Packet size limited during capture]
23899,0.313558,131.193.157.210,252.208.115.10,DNS,263,Standard query response 0x0808[Packet size limited during capture]
23952,0.314347,239.187.154.201,248.70.188.249,ICMP,68,"Echo (ping) reply    id=0x7265, seq=14882/8762, ttl=254"
23963,0.314559,3.3.122.118,2.164.162.14,TCP,1484,3462  >  3202 [ACK] Seq=1441 Ack=1 Win=63939 Len=1440[Packet size limited during capture]
23970,0.314616,249.136.206.164,174.97.32.94,SSL,111,[Packet size limited during capture]
24011,0.315118,3.3.241.139,172.8.142.5,TCP,1504,[TCP Retransmission] 10532  >  21011 [ACK] Seq=4294964377 Ack=1 Win=8760 Len=1460[Packet size limited during capture]
24158,0.317218,225.212.48.231,227.186.168.214,TCP,44,1747  >  80 [ACK] Seq=1 Ack=1 Win=46971 Len=0
24269,0.318831,227.247.15.149,239.64.216.12,TCP,482,"2189  >  19908 [PSH, ACK] Seq=267 Ack=1 Win=7941 Len=438[Packet size limited during capture]"
24272,0.318895,159.154.217.25,239.210.148.206,TCP,48,2553  >  3840 [SYN] Seq=0 Win=8192 Len=0 MSS=1460
24318,0.319703,69.77.84.144,162.132.83.73,TCP,44,2114  >  80 [ACK] Seq=1 Ack=1453 Win=17424 Len=0
24468,0.321467,3.3.122.118,2.164.162.14,TCP,1484,3462  >  3247 [ACK] Seq=1 Ack=1 Win=63888 Len=1440[Packet size limited during capture]
24567,0.322987,243.27.115.204,241.46.237.40,HTTP,790,Continuation[Packet size limited during capture]
24712,0.325001,157.193.226.3,227.124.131.48,TCP,52,"80  >  2249 [SYN, ACK] Seq=0 Ack=1 Win=5840 Len=0 MSS=1460[Packet size limited during capture]"
24841,0.326418,239.187.83.180,115.52.27.72,RDT,1041,DATA: stream-id=01 asm-rule=15 seq=02214 ts=66660  [Packet size limited during capture]
24908,0.327404,239.187.118.128,227.136.200.161,TCP,1504,80  >  1207 [ACK] Seq=1461 Ack=1 Win=11792 Len=1460[Packet size limited during capture]
24924,0.327628,107.193.42.133,0.3.117.70,TCP,44,2050  >  80 [ACK] Seq=1 Ack=86141 Win=65535 Len=0
25129,0.330433,156.105.42.101,140.136.72.76,TCP,52,1509  >  80 [SYN] Seq=0 Win=16384 Len=0 MSS=1460[Packet size limited during capture]
25365,0.333653,0.88.244.131,140.134.119.21,TCP,1504,"80  >  4781 [PSH, ACK] Seq=16061 Ack=1 Win=32120 Len=1460"
25449,0.3346,0.121.193.213,1.44.31.52,TCP,1404,80  >  2533 [ACK] Seq=68001 Ack=1 Win=6432 Len=1360[Packet size limited during capture]
25564,0.336138,225.212.71.31,241.46.188.93,HTTP,783,Continuation[Packet size limited during capture]
25649,0.337105,4.87.88.59,143.173.93.18,TCP,50,"6112  >  3325 [PSH, ACK] Seq=13 Ack=28 Win=17250 Len=6"
25672,0.337393,243.27.115.204,241.46.237.40,TCP,44,1119  >  80 [ACK] Seq=811 Ack=26032 Win=64860 Len=0
25769,0.338833,3.3.122.75,2.166.249.204,Gnutella,125,[Packet size limited during capture]
25831,0.339436,225.113.3.101,241.46.218.115,TCP,64,29938  >  80 [SYN] Seq=0 Win=65535 Len=0 MSS=1460[Packet size limited during capture]
25867,0.339914,241.46.72.153,162.131.209.252,TCP,1504,"80  >  11960 [PSH, ACK] Seq=11681 Ack=1 Win=32120 Len=1460[Packet size limited during capture]"
25903,0.3403,239.187.118.128,143.173.0.184,TCP,1504,80  >  4916 [ACK] Seq=5841 Ack=1 Win=6432 Len=1460[Packet size limited during capture]
26187,0.344545,227.139.62.114,4.14.19.113,TCP,44,66  >  1062 [ACK] Seq=1 Ack=10221 Win=32767 Len=0
26290,0.34584,236.161.133.7,241.201.117.150,TCP,44,[TCP Dup ACK 13547#1] 4047  >  80 [ACK] Seq=448 Ack=1 Win=17520 Len=0
26529,0.349325,3.3.128.12,239.66.240.75,TCP,1504,80  >  3827 [ACK] Seq=24821 Ack=1 Win=16712 Len=1460
26642,0.350593,0.2.74.221,240.23.220.102,TCP,580,"80  >  1158 [PSH, ACK] Seq=2145 Ack=1 Win=33232 Len=536[Packet size limited during capture]"
26668,0.350985,3.3.29.168,3.47.231.133,ESP,100,ESP (SPI=0x4164eb73)
26707,0.351442,238.57.108.29,1.212.36.10,TCP,56,37630  >  22 [ACK] Seq=97 Ack=913 Win=62672 Len=0[Packet size limited during capture]
26898,0.354147,238.109.204.173,238.14.207.3,TCP,52,"80  >  43672 [SYN, ACK] Seq=0 Ack=1 Win=5840 Len=0 MSS=1460[Packet size limited during capture]"
26910,0.354342,227.246.53.38,163.61.49.121,TCP,44,3410  >  443 [ACK] Seq=1 Ack=8689 Win=8688 Len=0
27111,0.35715,69.110.41.190,241.46.229.26,TCP,64,18080  >  80 [SYN] Seq=0 Win=65535 Len=0 MSS=1460[Packet size limited during capture]
27113,0.357178,3.3.239.69,4.117.39.220,IPv4,1504,"Fragmented IP protocol (proto=UDP 17, off=4440, ID=68d4)"
27698,0.364378,107.192.215.172,0.3.117.181,TCP,68,1624  >  10002 [SYN] Seq=0 Win=64240 Len=0 MSS=1460[Packet size limited during capture]
27806,0.366355,227.247.64.2,1.46.70.12,TCP,1504,8080  >  1364 [ACK] Seq=56777 Ack=1 Win=32120 Len=1460[Packet size limited during capture]
27964,0.368534,245.200.35.224,143.173.64.36,TCP,1504,"1476  >  1771 [PSH, ACK] Seq=13141 Ack=1 Win=32120 Len=1460[Packet size limited during capture]"
28098,0.370262,3.43.183.140,162.131.225.164,TCP,1504,80  >  43123 [ACK] Seq=8761 Ack=1 Win=6432 Len=1460
28109,0.370358,3.3.241.153,227.125.7.247,TCP,1504,"10114  >  2219 [PSH, ACK] Seq=1461 Ack=1 Win=8760 Len=1460[Packet size limited during capture]"
28164,0.371033,3.124.225.186,140.136.43.15,eDonkey,50,eDonkey UDP: Get Sources
28168,0.371064,3.195.251.81,3.193.111.66,UDP,77,1716  >  1075 Len=45
28190,0.371441,115.74.177.194,143.165.150.87,TCP,1504,1214  >  1821 [ACK] Seq=4381 Ack=1 Win=8428 Len=1460[Packet size limited during capture]
28213,0.371769,240.117.95.201,0.3.117.188,TCP,44,3033  >  80 [ACK] Seq=300 Ack=591 Win=64270 Len=0
28228,0.372059,3.3.241.159,2.164.167.114,TCP,1504,"[TCP Retransmission] 10646  >  49176 [PSH, ACK] Seq=1461 Ack=1 Win=8760 Len=1460[Packet size limited during capture]"
28388,0.37433,140.43.235.117,0.3.117.37,TCP,44,2054  >  80 [RST] Seq=1 Win=0 Len=0
28415,0.374597,165.60.94.35,162.141.80.1,ICMP,60,Time-to-live exceeded (Time to live exceeded in transit)[Packet size limited during capture]
28483,0.375549,0.121.193.213,3.13.73.143,TCP,1504,80  >  3811 [ACK] Seq=40881 Ack=1 Win=13936 Len=1460[Packet size limited during capture]
28491,0.375621,237.177.249.141,115.54.205.22,TCP,60,"1237  >  6699 [PSH, ACK] Seq=25 Ack=5001 Win=8760 Len=16"
28783,0.379513,227.209.187.135,241.247.121.209,TCP,846,"80  >  3192 [PSH, ACK] Seq=4286 Ack=1 Win=32120 Len=802[Packet size limited during capture]"
28960,0.381877,237.13.78.176,241.46.218.115,TCP,44,"1154  >  80 [FIN, ACK] Seq=1 Ack=1 Win=8048 Len=0"
29036,0.382726,227.247.110.67,241.230.170.41,TCP,1424,[TCP Retransmission] 80  >  1865 [ACK] Seq=1381 Ack=1 Win=64240 Len=1380[Packet size limited during capture]
29038,0.382763,0.7.240.165,238.109.212.178,HTTP,896,Continuation[Packet size limited during capture]
29274,0.386319,241.173.217.28,0.3.167.212,POP,50,S: +OK 
29333,0.386923,3.3.240.96,239.66.140.207,TCP,480,"14520  >  21041 [PSH, ACK] Seq=1025 Ack=1 Win=9216 Len=436[Packet size limited during capture]"
29447,0.388335,3.3.131.202,2.165.134.78,TCP,1496,80  >  4244 [ACK] Seq=2972 Ack=563 Win=24684 Len=1452[Packet size limited during capture]
29531,0.38918,0.2.72.16,236.118.195.92,DNS,128,Standard query response 0xdd0a[Packet size limited during capture]
29783,0.392786,238.255.64.152,227.221.229.202,TCP,1504,80  >  3036 [ACK] Seq=2921 Ack=1 Win=65535 Len=1460[Packet size limited during capture]
29873,0.394207,3.172.0.22,227.198.144.208,TCP,56,7338  >  80 [ACK] Seq=51 Ack=6841 Win=15048 Len=0[Packet size limited during capture]
30005,0.396261,0.63.69.130,1.204.249.9,TCP,44,443  >  2498 [ACK] Seq=147 Ack=611 Win=6432 Len=0
30122,0.397658,3.3.241.157,71.37.96.185,TCP,1504,10730  >  3978 [ACK] Seq=4081 Ack=1 Win=8760 Len=1460[Packet size limited during capture]
30175,0.398521,1.78.241.105,238.109.212.245,TCP,56,25  >  54874 [ACK] Seq=47 Ack=13681 Win=12456 Len=0[Packet size limited during capture]
30321,0.400745,249.120.120.104,238.109.212.178,TCP,64,30926  >  80 [SYN] Seq=0 Win=65535 Len=0 MSS=1460[Packet size limited during capture]
30376,0.401602,237.13.241.245,115.40.66.175,TCP,1220,"1068  >  6699 [PSH, ACK] Seq=26037 Ack=1 Win=23358 Len=1176[Packet size limited during capture]"
30614,0.404559,3.3.241.151,249.154.200.60,TCP,1504,"10410  >  23585 [PSH, ACK] Seq=1461 Ack=1 Win=8760 Len=1460[Packet size limited during capture]"
30679,0.405606,87.226.246.184,162.131.189.129,TCP,44,4915  >  8080 [ACK] Seq=1 Ack=5841 Win=8760 Len=0
30752,0.406709,237.104.251.150,242.5.80.235,TCP,64,64449  >  1214 [ACK] Seq=1 Ack=1 Win=8576 Len=0[Packet size limited during capture]
30757,0.406784,236.242.143.227,3.176.7.194,TCP,66,"6699  >  3069 [PSH, ACK] Seq=1 Ack=288 Win=17233 Len=22[Packet size limited during capture]"
30768,0.406895,0.2.74.228,115.44.117.204,TCP,106,"8010  >  3722 [PSH, ACK] Seq=1 Ack=1 Win=33120 Len=62[Packet size limited during capture]"
30806,0.407366,237.83.213.215,241.46.218.115,TCP,132,"47822  >  80 [PSH, ACK] Seq=1 Ack=1 Win=17520 Len=76[Packet size limited during capture]"
30939,0.409281,245.29.13.140,162.139.89.1,DNS,69,Standard query 0x27fd[Packet size limited during capture]
30982,0.409934,245.2.181.252,162.131.190.52,TCP,1504,1214  >  56513 [ACK] Seq=1461 Ack=1 Win=8508 Len=1460[Packet size limited during capture]
